{
  "schema_version": "2.0.0",
  "export_type": "connected_sustainability_platform_bundle",
  "platform_id": "sustainable-catalyst-connected",
  "platform_fingerprint": "0123456789abcdef0123456789abcdef",
  "package": {
    "name": "catalystanalyticsr",
    "version": "2.1.0"
  },
  "created_at": "2026-07-17T23:40:00Z",
  "file_count": 9,
  "files": [
    {
      "file": "connected-platform.json",
      "bytes": 12000,
      "md5": "aaaaaaaaaaaaaaaaaaaaaaaaaaaaaaaa"
    }
  ],
  "integrity": {
    "hash_algorithm": "md5",
    "complete": true,
    "scope": "all_bundle_files_except_manifest"
  },
  "boundary": {
    "human_review_required": true,
    "automated_decision_authorization": false,
    "automated_publication": false,
    "external_identity_and_transport_provided_by_host": true
  }
}
